{
  "backstop": {
    "armed_after": 2,
    "armed_before": null,
    "conditional": [
      {
        "on": "foreign region in file:/root/.ssh/authorized_keys",
        "step": 2
      }
    ],
    "covers": [
      1,
      2
    ],
    "drift_policy": {
      "1": "clobber",
      "2": "clobber"
    },
    "granularity_s": 60,
    "installed_before": 1,
    "late_arming_window": [
      1,
      2
    ],
    "locus": "target",
    "scheduler": "cron",
    "self_enforced": true,
    "snapshots": {
      "cap_bytes": 1048576,
      "location": "target"
    },
    "triggers": [
      "after 4h",
      "unless heartbeat within 1m every 20s"
    ]
  },
  "commit_step": null,
  "controller_only_undos": [
    3,
    4
  ],
  "deferred": [],
  "diagnostics": [],
  "dispatch": {
    "host_contract_hash": "-",
    "source": "inventory"
  },
  "fires_by_construction": false,
  "gate": {
    "min_distinct_humans": 1,
    "satisfiable": true,
    "wait_alone_at_s": null,
    "window_s": 1800,
    "zero_human_path": false
  },
  "held_indefinitely": [],
  "holds_at": [],
  "host": "db-01",
  "hosts_touched": {
    "1": [
      {
        "directory": "target",
        "host": "db-01"
      }
    ],
    "2": [
      {
        "directory": "target",
        "host": "db-01"
      }
    ],
    "3": [
      {
        "directory": "controller",
        "host": "bmc-01"
      }
    ],
    "4": [
      {
        "directory": "controller",
        "host": "controller"
      }
    ]
  },
  "induced_defer": [],
  "intent": "temporary",
  "may_conflicts": [],
  "mode": "manual",
  "plan": "breakglass",
  "point_of_no_return": null,
  "rehearsal": false,
  "reversible_back_to": null,
  "reversible_through": 4,
  "status": "ok",
  "steps": [
    {
      "conditional": null,
      "drift": "clobber",
      "footprint": [
        "owned: file:/etc/ssh/sshd_config.d/rescind-breakglass.conf",
        "derived: probe:sshd_posture"
      ],
      "gate": null,
      "knell": null,
      "locus": "target",
      "n": 1,
      "op": "service_posture",
      "refusal": "revert",
      "undo": "remove file:/etc/ssh/sshd_config.d/rescind-breakglass.conf",
      "undo_locus": "target"
    },
    {
      "conditional": "foreign region in file:/root/.ssh/authorized_keys",
      "drift": "clobber",
      "footprint": [
        "region: file:/root/.ssh/authorized_keys anchor rescind-breakglass"
      ],
      "gate": null,
      "knell": null,
      "locus": "target",
      "n": 2,
      "op": "authorized_keys_block",
      "refusal": "revert",
      "undo": "strip anchor rescind-breakglass from file:/root/.ssh/authorized_keys",
      "undo_locus": "target"
    },
    {
      "conditional": null,
      "drift": "defer",
      "footprint": [
        "modified: bmc:account:breakglass"
      ],
      "gate": null,
      "knell": null,
      "locus": "host(bmc-01)",
      "n": 3,
      "op": "bmc_account_enable",
      "refusal": "revert",
      "undo": "hook :bmc_disable(account: breakglass)",
      "undo_locus": "controller"
    },
    {
      "conditional": null,
      "drift": null,
      "footprint": [
        "held: proc:vnc_tunnel"
      ],
      "gate": null,
      "knell": null,
      "locus": "controller",
      "n": 4,
      "op": "console_tunnel",
      "refusal": "revert",
      "undo": "vnc-tunnel down",
      "undo_locus": "controller"
    }
  ],
  "unresolved_bindings": [],
  "verdict_version": 1,
  "wane_s": 14400
}
